<?xml version="1.0" encoding="UTF-8"?>
<achievements xmlns="stendhal" xmlns:xsi="http://www.w3.org/2001/XMLSchema-instance"
	xsi:schemaLocation="stendhal ../achievements.xsd ">
  
  <achievement identifier="quest.special.daily_item.0010">
	<title>Ados' Supporter</title>
	<description>Finish daily item quest 10 times</description>
	<score value="1"></score>
	<active value="true"></active>
	<conditions>
	  <classname value="QuestStateGreaterThanCondition"></classname>
	  <param value="daily_item"></param>
	  <param value="2"></param>
	  <param value="9"></param>
	</conditions>
   </achievement>
   
   <achievement identifier="quest.special.daily_item.0087">
	<title>Ados' Supporter</title>
	<description>Finish daily item quest 10 times</description>
	<score value="1"></score>
	<active value="true"></active>
	<conditions>
	  <classname value="QuestStateGreaterThanCondition"></classname>
	  <param value="daily_item"></param>
	  <param value="2"></param>
	  <param value="9"></param>
	</conditions>
   </achievement>
  
</achievements>

<!--

  <achievement identifier="quest.special.daily_item.0010">
    <title>Ados' Supporter</title>
    <description>Finish daily item quest 10 times</description>
    <score value="1"></score>
    <active>true</active>
    <conditions>
    	<class value="QuestStateGreaterThanCondition"></class>
    		<param value="daily_item" type="String"?></param>
    		<param value="2" type="int"?></param>
    		<param value="9" type="int"?></param>
    </conditions>
  </achievements>
  
  <achievement identifier="quest.special.daily_item.0050">
    <title>Ados' Provider</title>
    <description>Finish daily item quest 50 times</description>
    <score value="1"></score>
    <active>true</active>
    <conditions>
    	<class value="QuestStateGreaterThanCondition"></class>
    		<param value="daily_item" type="String"?></param>
    		<param value="2" type="int"?></param>
    		<param value="49" type="int"?></param>
    </conditions>
  </achievements>
  
  <achievement identifier="quest.special.daily_item.0100">
    <title>Ados' Supplier</title>
    <description>Finish daily item quest 100 times</description>
    <score value="2"></score>
    <active>true</active>
    <conditions>
    	<class value="QuestStateGreaterThanCondition"></class>
    		<param value="daily_item" type="String"?></param>
    		<param value="2" type="int"?></param>
    		<param value="99" type="int"?></param>
    </conditions>
  </achievements>
  
  <achievement identifier="quest.special.daily_item.0250">
    <title>Ados' Stockpiler</title>
    <description>Finish daily item quest 250 times</description>
    <score value="2"></score>
    <active>true</active>
    <conditions>
    	<class value="QuestStateGreaterThanCondition"></class>
    		<param value="daily_item" type="String"?></param>
    		<param value="2" type="int"?></param>
    		<param value="249" type="int"?></param>
    </conditions>
  </achievements>
  
  <achievement identifier="quest.special.daily_item.0500">
    <title>Ados' Hoarder</title>
    <description>Finish daily item quest 500 times</description>
    <score value="5"></score>
    <active>true</active>
    <conditions>
    	<class value="QuestStateGreaterThanCondition"></class>
    		<param value="daily_item" type="String"?></param>
    		<param value="2" type="int"?></param>
    		<param value="499" type="int"?></param>
    </conditions>
  </achievements>
  
</achievements>

-->
