<?xml version="1.0" encoding="UTF-8"?>
<achievements xmlns="stendhal" xmlns:xsi="http://www.w3.org/2001/XMLSchema-instance"
	xsi:schemaLocation="stendhal ../achievements.xsd ">

  <achievement identifier=quest.special.weekly_item.0005">
    <title>Archaeologist</title>
    <description>Finish weekly item quest 5 times</description>
    <score value="5"></score>
    <active value = "true" ></active>
    <conditions>
    	<classname value ="QuestStateGreaterThanCondition"</classname>
    		<param value="weekly_item"?></value>
    		<param value="2"?></value>
    		<param value="4"?></value>
    </conditions>
  </achievement>
  
  <achievement identifier=quest.special.weekly_item.0025">
    <title> Dedicated Archaeologist</title>
    <description>Finish weekly item quest 25 times</description>
    <score value="5"></score>
    <active value = "true" ></active>
    <conditions>
    	<classname value ="QuestStateGreaterThanCondition"</classname>
    		<param value="weekly_item"?></value>
    		<param value="2"?></value>
    		<param value="24"?></value>
    </conditions>
  </achievement>
  
  <achievement identifier=quest.special.weekly_item.0050">
    <title>Senior Archaeologist</title>
    <description>Finish weekly item quest 50 times</description>
    <score value="5"></score>
    <active value = "true" ></active>
    <conditions>
    	<classname value ="QuestStateGreaterThanCondition"</classname>
    		<param value="weekly_item"?></value>
    		<param value="2"?></value>
    		<param value="49"?></value>
    </conditions>
  </achievement>

  <achievement identifier=quest.special.weekly_item.0100">
    <title>Master Archaeologist</title>
    <description>Finish weekly item quest 100 times</description>
    <score value="5"></score>
    <active value = "true" ></active>
    <conditions>
    	<classname value ="QuestStateGreaterThanCondition"</classname>
    		<param value="weekly_item"?></value>
    		<param value="2"?></value>
    		<param value="99"?></value>
    </conditions>
  </achievement>
  
</achievements>
