<?xml version="1.0" encoding="UTF-8"?>
<achievements xmlns="stendhal" xmlns:xsi="http://www.w3.org/2001/XMLSchema-instance"
	xsi:schemaLocation="stendhal ../achievements.xsd ">

  <achievement identifier="zone.interior.semos">
	<title>Home maker</title>
	<description>Visit all interior zones in the Semos region</description>
	<score value="3"></score>
	<active value="true"></active>
	<conditions>
	  <classname value="PlayerVisitedZonesInRegionCondition"></classname>
	  <param value="semos"></param>
	  <param value="false"></param>
	  <param value="false"></param>
	</conditions>
   </achievement>

  <achievement identifier="zone.interior.nalwor">
	<title>Elf visitor</title>
	<description>Visit all interior zones in the Nalwor region</description>
	<score value="3"></score>
	<active value="true"></active>
	<conditions>
	  <classname value="PlayerVisitedZonesInRegionCondition"></classname>
	  <param value="nalwor"></param>
	  <param value="false"></param>
	  <param value="false"></param>
	</conditions>
   </achievement>
   
     <achievement identifier="zone.interior.ados">
	<title>Up town guy</title>
	<description>Visit all accessible interior zones in the Ados region</description>
	<score value="3"></score>
	<active value="true"></active>
	<conditions>
	  <classname value="PlayerVisitedZonesInRegionCondition"></classname>
	  <param value="ados"></param>
	  <param value="false"></param>
	  <param value="false"></param>
	</conditions>
   </achievement>
   
     <achievement identifier="zone.interior.wofolcity">
	<title>Kobold City</title>
	<description>Visit all interior zones in Wo'fol</description>
	<score value="3"></score>
	<active value="true"></active>
	<conditions>
	  <classname value="PlayerVisitedZonesInRegionCondition"></classname>
	  <param value="wofol city"></param>
	  <param value="false"></param>
	  <param value="false"></param>
	</conditions>
   </achievement>
   
     <achievement identifier="zone.interior.magiccity">
	<title>Magic City</title>
	<description>Visit all interior zones in the underground Magic city</description>
	<score value="3"></score>
	<active value="true"></active>
	<conditions>
	  <classname value="PlayerVisitedZonesInRegionCondition"></classname>
	  <param value="magic city"></param>
	  <param value="false"></param>
	  <param value="false"></param>
	</conditions>
   </achievement>

</achievements>

